{
  "baseline": "8f26c1fe21deec75c9bfd83ecb16cbd676ffc0d3",
  "branch": "fix/issue-87-bd2020",
  "checkpointId": "W87",
  "checkpointPath": "docs/work/workers/W87",
  "contractRevision": "https://github.com/Bilaltariq41/SeqDoc/issues/87#issuecomment-5558523794",
  "dependencies": [],
  "expectedGithubState": "OPEN",
  "id": "GH-87",
  "kind": "github-issue",
  "lifecycle": "Ready",
  "lifecycleLabel": "ready",
  "nextAction": "Complete repeated readiness review and validation in PR #88, merge the readiness record, then select GH-87 for implementation.",
  "number": 87,
  "owner": "bilal",
  "pr": null,
  "schemaVersion": 1,
  "selectedForExecution": false,
  "sourceUrl": "https://github.com/Bilaltariq41/SeqDoc/issues/87",
  "statusReason": "Abood and Qais approved the frozen T3 scope; bounded takeover W87-F5 now explicitly requires that ambiguous mapping emit no CatchContinuations entry.",
  "title": "[Workers] Keep BD2020 catch-continuation withholding non-blocking",
  "track": "workers"
}
