{
  "baseline": "ab6e3e1cf16213ee5346506b16949fa32c4ddfa4",
  "branch": "integration/issue-106-process-ownership-ahmad",
  "checkpointId": "I100-A",
  "checkpointPath": "docs/work/quality/I100-A",
  "contractRevision": "https://github.com/Bilaltariq41/SeqDoc/pull/109#issuecomment-5709738022",
  "dependencies": [],
  "expectedGithubState": "OPEN",
  "id": "GH-106",
  "kind": "github-issue",
  "lifecycle": "ReviewRequired",
  "lifecycleLabel": "review-required",
  "nextAction": "Abood must commit and push the final candidate, then request Ahmad's authenticated exact-head PASS or BLOCK under Bilal's PR #109 owner bypass. Do not describe the review as independent and do not run the final gate before PASS.",
  "number": 106,
  "owner": "abood",
  "pr": "https://github.com/Bilaltariq41/SeqDoc/pull/109",
  "schemaVersion": 1,
  "selectedForExecution": true,
  "sourceUrl": "https://github.com/Bilaltariq41/SeqDoc/issues/106",
  "statusReason": "Current main fa20535 is integrated at 26ee63e; focused verification passed 76/76 and independent post-integration review passed with no findings. Bilal's authenticated PR #109 bypass authorizes Ahmad's final non-independent exact-head technical review when Ahmad is not the final pusher.",
  "title": "[Testing] Prove Windows contained-process ownership primitive",
  "track": "quality"
}
