{
  "baseline": "0b8e4b7a91cf52e4a98542bcc307f9262414efdf",
  "branch": "acceptance/issue-53-outbound-http",
  "checkpointId": "QHTTP-B",
  "checkpointPath": "docs/work/outbound-http/QHTTP-B",
  "contractRevision": "https://github.com/Bilaltariq41/SeqDoc/issues/53",
  "dependencies": [
    "GH-54"
  ],
  "expectedGithubState": "OPEN",
  "id": "GH-53",
  "kind": "acceptance",
  "lifecycle": "Verifying",
  "lifecycleLabel": "verifying",
  "nextAction": "Obtain Ahmad's final approval on the resulting exact SHA; verify required status checks and resolved conversations; then confirm merge readiness without merging.",
  "number": 53,
  "owner": "qais",
  "pr": "https://github.com/Bilaltariq41/SeqDoc/pull/67",
  "schemaVersion": 1,
  "selectedForExecution": true,
  "sourceUrl": "https://github.com/Bilaltariq41/SeqDoc/issues/53",
  "statusReason": "Post-change review and inherited focused/final verification are complete; only Ahmad's final exact-SHA approval and merge-readiness checks remain.",
  "title": "[Outbound HTTP] FraudManagement GET/POST acceptance",
  "track": "services"
}
