{
  "baseline": "ac1a41f25357b32fbf2e0b2bff82ffc6cb1fe586",
  "branch": "acceptance/issue-18-worker-recovery",
  "checkpointId": "I18",
  "checkpointPath": "docs/work/workers/I18",
  "contractRevision": "https://github.com/Bilaltariq41/SeqDoc/issues/18",
  "dependencies": [
    "GH-16",
    "GH-17",
    "GH-87"
  ],
  "expectedGithubState": "OPEN",
  "id": "GH-18",
  "kind": "acceptance",
  "lifecycle": "ReviewRequired",
  "lifecycleLabel": "review-required",
  "nextAction": "Arrange one independent exact-head review of PR #103 against docs/work/workers/I18/checkpoint.md before any final-gate action; do not rerun the focused command on the unchanged candidate.",
  "number": 18,
  "owner": "abood",
  "pr": "https://github.com/Bilaltariq41/SeqDoc/pull/103",
  "schemaVersion": 1,
  "selectedForExecution": true,
  "sourceUrl": "https://github.com/Bilaltariq41/SeqDoc/issues/18",
  "statusReason": "Owner-authorized HANDOFF-DECISION v1 (https://github.com/Bilaltariq41/SeqDoc/issues/18#issuecomment-5665166508) transferred the exact unchanged reviewed candidate as PR #103 for owner inspection; reconciling lifecycle to ReviewRequired pending one independent exact-head review before any final-gate action.",
  "title": "[Workers] Supplied-project worker and recovery acceptance",
  "track": "workers"
}
