{
  "baseline": "d09ed1c17631722d4b3e431cef8e8ea1430cf80b",
  "branch": "acceptance/issue-13-persistence",
  "checkpointId": "I13",
  "checkpointPath": "docs/work/persistence/I13",
  "contractRevision": "https://github.com/Bilaltariq41/SeqDoc/issues/13#issuecomment-5511399631",
  "dependencies": [
    "GH-12"
  ],
  "expectedGithubState": "OPEN",
  "id": "GH-13",
  "kind": "acceptance",
  "lifecycle": "Blocked",
  "lifecycleLabel": "blocked",
  "nextAction": "Resolve the frozen dependencies and reactivate I13 only after their reviewed merges.",
  "number": 13,
  "owner": "ahmad",
  "pr": null,
  "schemaVersion": 1,
  "selectedForExecution": false,
  "sourceUrl": "https://github.com/Bilaltariq41/SeqDoc/issues/13",
  "statusReason": "The hardened four-corpus acceptance lane exposed separate diagnostic-path, persistence-visibility, and stale-root dependencies; preserve the candidate and do not run review or the final gate.",
  "title": "[Persistence] Supplied-project persistence acceptance",
  "track": "persistence"
}
