{
  "baseline": null,
  "branch": null,
  "checkpointId": null,
  "checkpointPath": null,
  "contractRevision": "https://github.com/Bilaltariq41/SeqDoc/issues/69",
  "dependencies": [],
  "expectedGithubState": "OPEN",
  "id": "GH-69",
  "kind": "parent",
  "lifecycle": "Active",
  "lifecycleLabel": "active",
  "nextAction": null,
  "number": 69,
  "owner": "unassigned",
  "pr": null,
  "schemaVersion": 1,
  "selectedForExecution": false,
  "sourceUrl": "https://github.com/Bilaltariq41/SeqDoc/issues/69",
  "statusReason": "Active neutral coordination parent; implementation issues are independently claimable when their own readiness and dependencies pass. No implementation occurs in the parent.",
  "title": "[Workstream] SeqDoc v1 completion program",
  "track": "governance"
}
