{
  "baseline": "e6dfc038f304f8265f6228052ebb326d882c5157",
  "branch": "fix/issue-85-loop-fixtures",
  "checkpointId": "QLOOP1",
  "checkpointPath": "docs/work/quality/QLOOP1",
  "contractRevision": "https://github.com/Bilaltariq41/SeqDoc/issues/85",
  "dependencies": [],
  "expectedGithubState": "OPEN",
  "id": "GH-85",
  "kind": "github-issue",
  "lifecycle": "ReviewRequired",
  "lifecycleLabel": "review-required",
  "nextAction": "Run one independent complete-candidate review of PR #86 and resolve every finding before the final Behavior gate.",
  "number": 85,
  "owner": "bilal",
  "pr": "https://github.com/Bilaltariq41/SeqDoc/pull/86",
  "schemaVersion": 1,
  "selectedForExecution": true,
  "sourceUrl": "https://github.com/Bilaltariq41/SeqDoc/issues/85",
  "statusReason": "The four-test focused lane passed 4/4 after bounded repair round 2; the complete candidate is ready for independent review.",
  "title": "[Quality] Repair stale compiler-backed loop fixtures",
  "track": "quality"
}
