{
  "baseline": "a3def8c1bb33f4fa9df83298e63dc87e9478b824",
  "branch": "feature/issue-17-recovery-callbacks",
  "checkpointId": "P17-R1",
  "checkpointPath": "docs/work/workers/P17-R1",
  "contractRevision": "https://github.com/Bilaltariq41/SeqDoc/issues/17#issuecomment-5494748157",
  "dependencies": [
    "GH-16"
  ],
  "expectedGithubState": "CLOSED",
  "id": "GH-17",
  "kind": "github-issue",
  "lifecycle": "Closed",
  "lifecycleLabel": null,
  "nextAction": "Issue #18 may proceed from current main under a separately frozen Ready contract; no additional Issue #17 implementation remains.",
  "number": 17,
  "owner": "abood",
  "pr": "https://github.com/Bilaltariq41/SeqDoc/pull/64",
  "schemaVersion": 1,
  "selectedForExecution": false,
  "sourceUrl": "https://github.com/Bilaltariq41/SeqDoc/issues/17",
  "statusReason": "PR #64 was accepted at head 111adafcbb329c951edd69e2441c3f832a46d559 after current-main integration, resolved F1-F4, focused verification (41 Analysis, 22 Scenario, 14 Wording, 2 Rendering), a zero-warning Release build, and broad no-regression evidence. Broad failures matched current-main local-SDK or missing standalone-fixture-restore signatures and did not involve Issue #17 behavior.",
  "title": "[Workers] Recovery state and callback boundaries",
  "track": "workers"
}
